{"schema_version":1,"knowledge_set_id":"KNOWSET.mul.calendar.seasons","topic":"seasons","set_kind":"ordered_cycle","canonical_concept_keys":["spring","summer","autumn","winter"],"target_language_policy":{"registry_source":"Clickabl/gef-expo/registry/language-support.json","allowed_lesson_tiers":[1,2],"notes":"Only Tier 1 and Tier 2 languages may be learning/target languages for this lesson. Any canonical learn-from language may still supply explanation/comparison copy."},"context_policy":{"teaching_order_is_not_locale_layout":false,"territory_controls_week_layout":false,"calendar_system_sensitive":true,"hemisphere_sensitive":true,"climate_sensitive":true,"notes":"Four temperate seasons are a useful comparison layer, not a claim that every culture or climate divides the year that way. Runtime cultural notes must account for hemisphere, local climate, and traditional seasonal systems."},"language_records":[{"language_tag":"en","primary_system_id":"temperate_four_seasons","systems":[{"system_id":"temperate_four_seasons","label_en":"Four broad temperate seasons","scope":"everyday","terms":["spring","summer","autumn","winter"],"variants":{"autumn":["fall"]}}],"review_state":"candidate","trust_state":"machine_translated"},{"language_tag":"es","primary_system_id":"temperate_four_seasons","systems":[{"system_id":"temperate_four_seasons","label_en":"Four broad temperate seasons","scope":"everyday","terms":["primavera","verano","otoño","invierno"]}],"review_state":"candidate","trust_state":"machine_translated"},{"language_tag":"fr","primary_system_id":"temperate_four_seasons","systems":[{"system_id":"temperate_four_seasons","label_en":"Four broad temperate seasons","scope":"everyday","terms":["printemps","été","automne","hiver"]}],"review_state":"candidate","trust_state":"machine_translated"},{"language_tag":"pt","primary_system_id":"temperate_four_seasons","systems":[{"system_id":"temperate_four_seasons","label_en":"Four broad temperate seasons","scope":"everyday","terms":["primavera","verão","outono","inverno"]}],"review_state":"candidate","trust_state":"machine_translated"},{"language_tag":"it","primary_system_id":"temperate_four_seasons","systems":[{"system_id":"temperate_four_seasons","label_en":"Four broad temperate seasons","scope":"everyday","terms":["primavera","estate","autunno","inverno"]}],"review_state":"candidate","trust_state":"machine_translated"},{"language_tag":"el","primary_system_id":"temperate_four_seasons","systems":[{"system_id":"temperate_four_seasons","label_en":"Four broad temperate seasons","scope":"everyday","terms":["άνοιξη","καλοκαίρι","φθινόπωρο","χειμώνας"]}],"review_state":"candidate","trust_state":"machine_translated"},{"language_tag":"zh","primary_system_id":"temperate_four_seasons","systems":[{"system_id":"temperate_four_seasons","label_en":"Four broad temperate seasons","scope":"everyday","terms":["春天","夏天","秋天","冬天"],"transliterations":["chūntiān","xiàtiān","qiūntiān","dōngtiān"],"variants":{"spring":["春季"],"summer":["夏季"],"autumn":["秋季"],"winter":["冬季"]}}],"culture_notes":[{"note_id":"zh.solar_terms","type":"season_system","title_en":"Four seasons, plus 24 solar terms","text_en":"Chinese tradition also divides the annual solar cycle into 24 solar terms tied to seasonal change and agriculture; the basic four season words are only one layer of that system.","source_refs":["hko-24-solar-terms","china-24-solar-terms"]}],"review_state":"candidate","trust_state":"machine_translated"},{"language_tag":"ja","primary_system_id":"temperate_four_seasons","systems":[{"system_id":"temperate_four_seasons","label_en":"Four broad temperate seasons","scope":"everyday","terms":["春","夏","秋","冬"],"readings":["はる","なつ","あき","ふゆ"]}],"culture_notes":[{"note_id":"ja.solar_terms","type":"season_system","title_en":"Season vocabulary has finer traditional divisions","text_en":"Japanese cultural calendars also use the inherited 24 solar-term system, so 春・夏・秋・冬 are the broad four-season layer rather than the only way the year can be divided.","source_refs":["unicode-cldr-date-time-names"]}],"review_state":"candidate","trust_state":"machine_translated"},{"language_tag":"de","primary_system_id":"temperate_four_seasons","systems":[{"system_id":"temperate_four_seasons","label_en":"Four broad temperate seasons","scope":"everyday","terms":["Frühling","Sommer","Herbst","Winter"]}],"review_state":"candidate","trust_state":"machine_translated"},{"language_tag":"ko","primary_system_id":"temperate_four_seasons","systems":[{"system_id":"temperate_four_seasons","label_en":"Four broad temperate seasons","scope":"everyday","terms":["봄","여름","가을","겨울"]}],"review_state":"candidate","trust_state":"machine_translated"},{"language_tag":"ar","primary_system_id":"temperate_four_seasons","systems":[{"system_id":"temperate_four_seasons","label_en":"Four broad temperate seasons","scope":"everyday","terms":["الربيع","الصيف","الخريف","الشتاء"]}],"review_state":"candidate","trust_state":"machine_translated"},{"language_tag":"hi","primary_system_id":"temperate_four_seasons","systems":[{"system_id":"temperate_four_seasons","label_en":"Four broad temperate seasons","scope":"everyday","terms":["वसंत","गर्मी","पतझड़","सर्दी"]},{"system_id":"traditional_six_ritus","label_en":"Traditional six ritus","scope":"traditional","terms":["वसंत","ग्रीष्म","वर्षा","शरद","हेमंत","शिशिर"],"region_tags":["IN"],"concept_keys":["vasanta","grishma","varsha","sharada","hemanta","shishira"]}],"culture_notes":[{"note_id":"hi.six_ritus","type":"season_system","title_en":"A traditional six-season cycle","text_en":"A traditional north and central Indian model divides the year into six two-month seasons: Vasanta, Grishma, Varsha, Sharada, Hemanta, and Shishira. This does not map equally well to every part of India.","source_refs":["ncert-six-seasons"]}],"review_state":"candidate","trust_state":"machine_translated"},{"language_tag":"uk","primary_system_id":"temperate_four_seasons","systems":[{"system_id":"temperate_four_seasons","label_en":"Four broad temperate seasons","scope":"everyday","terms":["весна","літо","осінь","зима"]}],"review_state":"candidate","trust_state":"machine_translated"},{"language_tag":"ru","primary_system_id":"temperate_four_seasons","systems":[{"system_id":"temperate_four_seasons","label_en":"Four broad temperate seasons","scope":"everyday","terms":["весна","лето","осень","зима"]}],"review_state":"candidate","trust_state":"machine_translated"},{"language_tag":"tr","primary_system_id":"temperate_four_seasons","systems":[{"system_id":"temperate_four_seasons","label_en":"Four broad temperate seasons","scope":"everyday","terms":["ilkbahar","yaz","sonbahar","kış"]}],"review_state":"candidate","trust_state":"machine_translated"},{"language_tag":"pl","primary_system_id":"temperate_four_seasons","systems":[{"system_id":"temperate_four_seasons","label_en":"Four broad temperate seasons","scope":"everyday","terms":["wiosna","lato","jesień","zima"]}],"review_state":"candidate","trust_state":"machine_translated"},{"language_tag":"fa","primary_system_id":"temperate_four_seasons","systems":[{"system_id":"temperate_four_seasons","label_en":"Four broad temperate seasons","scope":"everyday","terms":["بهار","تابستان","پاییز","زمستان"]}],"culture_notes":[{"note_id":"fa.nowruz_season","type":"calendar_system","title_en":"Spring and the new year meet at Nowruz","text_en":"In Iran's Solar Hijri calendar, the year begins at Nowruz around the vernal equinox, so بهار and the first month فروردین line up with the start of the new year.","region_tags":["IR"],"source_refs":["iranica-solar-hijri"]}],"review_state":"candidate","trust_state":"machine_translated"},{"language_tag":"id","primary_system_id":"temperate_four_seasons","systems":[{"system_id":"temperate_four_seasons","label_en":"Four broad temperate seasons","scope":"everyday","terms":["musim semi","musim panas","musim gugur","musim dingin"]},{"system_id":"indonesia_wet_dry","label_en":"Indonesian wet/dry seasons","scope":"climate","terms":["musim hujan","musim kemarau"],"region_tags":["ID"],"concept_keys":["wet","dry"]}],"culture_notes":[{"note_id":"id.wet_dry","type":"climate","title_en":"Wet and dry seasons matter locally","text_en":"In Indonesia, climate agencies commonly describe the year in terms of musim hujan and musim kemarau. The four temperate-season terms are useful international vocabulary, but they are not the best description of much of Indonesia's local climate.","source_refs":["bmkg-indonesia-seasons"]}],"review_state":"candidate","trust_state":"machine_translated"},{"language_tag":"ca","primary_system_id":"temperate_four_seasons","systems":[{"system_id":"temperate_four_seasons","label_en":"Four broad temperate seasons","scope":"everyday","terms":["primavera","estiu","tardor","hivern"]}],"review_state":"candidate","trust_state":"machine_translated"},{"language_tag":"gl","primary_system_id":"temperate_four_seasons","systems":[{"system_id":"temperate_four_seasons","label_en":"Four broad temperate seasons","scope":"everyday","terms":["primavera","verán","outono","inverno"]}],"review_state":"candidate","trust_state":"machine_translated"},{"language_tag":"mk","primary_system_id":"temperate_four_seasons","systems":[{"system_id":"temperate_four_seasons","label_en":"Four broad temperate seasons","scope":"everyday","terms":["пролет","лето","есен","зима"]}],"review_state":"candidate","trust_state":"machine_translated"}],"source_refs":["unicode-cldr-date-time-names","hko-24-solar-terms","china-24-solar-terms","ncert-six-seasons","bmkg-indonesia-seasons","iranica-solar-hijri"],"review_state":"candidate","trust_state":"machine_translated","version":1}